title,link,type
"Sparse Nonlinear Dynamics Models with SINDy, Part 4: The Library of Candidate Nonlinearities",https://www.youtube.com/watch?v=MmMNQe_EtCw,regular
"Sparse Nonlinear Dynamics Models with SINDy, Part 3: Effective Coordinates for Parsimonious Models",https://www.youtube.com/watch?v=1vrsBg92Xzo,regular
"Sparse Nonlinear Dynamics Models with SINDy, Part 2: Training Data & Disambiguating Models",https://www.youtube.com/watch?v=8-hoWTJwmrE,regular
Sparse Identification of Nonlinear Dynamics (SINDy): Sparse Machine Learning Models 5 Years Later!,https://www.youtube.com/watch?v=NxAn0oglMVw,regular
Deep Learning to Discover Coordinates for Dynamics: Autoencoders & Physics Informed Machine Learning,https://www.youtube.com/watch?v=KmQkDgu-Qp0,regular
The Anatomy of a Dynamical System,https://www.youtube.com/watch?v=-FvrON0OmYc,regular
Sparse Sensor Placement Optimization for Classification,https://www.youtube.com/watch?v=zJ2z__5mepA,regular
Interpretable Deep Learning for New Physics Discovery,https://www.youtube.com/watch?v=HKJB0Bjo6tQ,regular
Sparse Sensor Placement Optimization for Reconstruction,https://www.youtube.com/watch?v=BCygBhyrl8k,regular
Sparse Representation (for classification) with examples!,https://www.youtube.com/watch?v=DKgqLmobFtc,regular
Deep Learning for Turbulence Closure Modeling,https://www.youtube.com/watch?v=AgvjPPzy64I,regular
"Finite-Horizon, Energy-Optimal Trajectories in Unsteady Flows",https://www.youtube.com/watch?v=IBLR1TcFSCI,regular
Turbulence Closure Models: Reynolds Averaged Navier Stokes (RANS) & Large Eddy Simulations (LES),https://www.youtube.com/watch?v=zIQpxmLwbXQ,regular
"Turbulence: Reynolds Averaged Navier Stokes (RANS) Equations (Part 2, Momentum Equation)",https://www.youtube.com/watch?v=pe6AxHpvBJU,regular
"Turbulence: Reynolds Averaged Navier-Stokes (Part 1, Mass Continuity Equation)",https://www.youtube.com/watch?v=mDt-HJEXK6g,regular
Turbulence is Everywhere!  Examples of Turbulence and Canonical Flows,https://www.youtube.com/watch?v=RkewD966Y90,regular
What Is Turbulence?  Turbulent Fluid Dynamics are Everywhere,https://www.youtube.com/watch?v=v5IoP9Pc-Y0,regular
Deep Reinforcement Learning for Fluid Dynamics and Control,https://www.youtube.com/watch?v=NZNl-M040NY,regular
Deep Reinforcement Learning: Neural Networks for Learning Control Laws,https://www.youtube.com/watch?v=IUiKAD6cuTA,regular
Reinforcement Learning: Machine Learning Meets Control Theory,https://www.youtube.com/watch?v=0MNVhXEX9to,regular
Deep Learning of Hierarchical Multiscale Differential Equation Time Steppers,https://www.youtube.com/watch?v=Jfl3dIlSTrU,regular
Robust Principal Component Analysis (RPCA),https://www.youtube.com/watch?v=yDpz0PqULXQ,regular
Robust Regression with the L1 Norm [Matlab],https://www.youtube.com/watch?v=evjIHvze7xs,regular
Robust Regression with the L1 Norm [Python],https://www.youtube.com/watch?v=J_yzmBj_7TU,regular
Robust Regression with the L1 Norm,https://www.youtube.com/watch?v=KF5LaUVTBOY,regular
"Robust, Interpretable Statistical Models: Sparse Regression with the LASSO",https://www.youtube.com/watch?v=GaXfqoLR_yI,regular
"Beating Nyquist with Compressed Sensing, part 2",https://www.youtube.com/watch?v=HVR2DaaD0Xo,regular
Beating Nyquist with Compressed Sensing,https://www.youtube.com/watch?v=A8W1I3mtjp8,regular
"Beating Nyquist with Compressed Sensing, in Python",https://www.youtube.com/watch?v=5-LY6wBIKx8,regular
Shannon Nyquist Sampling Theorem,https://www.youtube.com/watch?v=FcXZ28BX-xE,regular
Machine Learning for Fluid Dynamics: Models and Control,https://www.youtube.com/watch?v=gb_C9LcjDSI,regular
Machine Learning for Fluid Dynamics: Patterns,https://www.youtube.com/watch?v=3fOXIbycAmc,regular
Data-driven nonlinear aeroelastic models of morphing wings for control,https://www.youtube.com/watch?v=b6CKpnzdflk,regular
Data-Driven Resolvent Analysis,https://www.youtube.com/watch?v=Biiby6ky71M,regular
Machine Learning for Fluid Mechanics,https://www.youtube.com/watch?v=8e3OT2K99Kw,regular
Data-driven Modeling of Traveling Waves,https://www.youtube.com/watch?v=bfeT_4k61N0,regular
Underdetermined systems and compressed sensing [Python],https://www.youtube.com/watch?v=_-Jkq-Faa2Y,regular
Underdetermined systems and compressed sensing [Matlab],https://www.youtube.com/watch?v=otr1YwNBWfc,regular
Sparsity and the L1 Norm,https://www.youtube.com/watch?v=76B5cMEZA4Y,regular
Compressed Sensing: When It Works,https://www.youtube.com/watch?v=hmBTACBGWJs,regular
Compressed Sensing: Mathematical Formulation,https://www.youtube.com/watch?v=inr-nGnVc0k,regular
Compressed Sensing: Overview,https://www.youtube.com/watch?v=SbU1pahbbkc,regular
"Sparsity and Parsimonious Models: Everything should be made as simple as possible, but no simpler",https://www.youtube.com/watch?v=9eGMJ3-wmm0,regular
Modeling synchronization in turbulent flows,https://www.youtube.com/watch?v=OfJgbaib3nk,regular
What is Sparsity?,https://www.youtube.com/watch?v=v3IlcbDz9eQ,regular
Why images are compressible: The Vastness of Image Space,https://www.youtube.com/watch?v=Dt2WYkqZfbs,regular
Sparsity and Compression: An Overview,https://www.youtube.com/watch?v=EOYaKcjFa3o,regular
Laplace Transforms and Differential Equations,https://www.youtube.com/watch?v=iBde8qOW0h0,regular
Laplace Transform Examples,https://www.youtube.com/watch?v=5hPD7CF0_54,regular
The Laplace Transform: A Generalized Fourier Transform,https://www.youtube.com/watch?v=7UvtU75NXTg,regular
Deep Learning of Dynamics and Coordinates with SINDy Autoencoders,https://www.youtube.com/watch?v=WHhDgxkiR9c,regular
Uncertainty Principles and the Fourier Transform,https://www.youtube.com/watch?v=D1WfID6kk90,regular
PySINDy: A Python Library for Model Discovery,https://www.youtube.com/watch?v=DvbbXX8Bd90,regular
Image Compression and Wavelets (Examples in Matlab),https://www.youtube.com/watch?v=jclknhNJBrE,regular
Image Compression with Wavelets (Examples in Python),https://www.youtube.com/watch?v=eJLF9HeZA8I,regular
Wavelets and Multiresolution Analysis,https://www.youtube.com/watch?v=y7KLbd7n75g,regular
Image Compression and the FFT (Examples in Python),https://www.youtube.com/watch?v=uB3v6n8t2dQ,regular
Image Compression with the FFT (Examples in Matlab),https://www.youtube.com/watch?v=KGiV_2i713I,regular
Image Compression and the FFT,https://www.youtube.com/watch?v=gGEBUdM0PVc,regular
Robust Modal Decompositions for Fluid Flows,https://www.youtube.com/watch?v=grdAW4oUUXk,regular
Exponential Growth and Euler,https://www.youtube.com/watch?v=jidUQPnRvM8,regular
Exponential Growth is a Lie,https://www.youtube.com/watch?v=Qxy5D4aINZ0,regular
Examples of Exponential Growth,https://www.youtube.com/watch?v=aOl7Beajb64,regular
Exponential Growth: Overview,https://www.youtube.com/watch?v=1tt-Xh0jix4,regular
Spectrogram Examples [Python],https://www.youtube.com/watch?v=TJGlxdW7Fb4,regular
Spectrogram Examples [Matlab],https://www.youtube.com/watch?v=2mB74QhDznI,regular
The Spectrogram and the Gabor Transform,https://www.youtube.com/watch?v=EfWnEldTyPA,regular
Control Theory and COVID-19: Summary,https://www.youtube.com/watch?v=zsJ0bbEvx5c,regular
Control Theory and COVID-19: Sensors,https://www.youtube.com/watch?v=ooNvhfepD_c,regular
Control Theory and COVID-19: Control Design,https://www.youtube.com/watch?v=BkpORajO3Ak,regular
Control Theory and COVID-19: Models,https://www.youtube.com/watch?v=jmfsSmHAQ2o,regular
Control Theory and COVID-19,https://www.youtube.com/watch?v=BTLZu-1IMcE,regular
"Solving PDEs with the FFT, Part 2 [Matlab]",https://www.youtube.com/watch?v=RilggJd1_LY,regular
"Solving PDEs with the FFT, Part 2 [Python]",https://www.youtube.com/watch?v=mMdIxa5qC9Y,regular
Solving PDEs with the FFT [Python],https://www.youtube.com/watch?v=hDeARtZdq-U,regular
Solving PDEs with the FFT [Matlab],https://www.youtube.com/watch?v=BkA7ncY0b7I,regular
Computing Derivatives with FFT [Python],https://www.youtube.com/watch?v=y8SqkjoKV4k,regular
Computing Derivatives with FFT [Matlab],https://www.youtube.com/watch?v=BCexJ-yfdi8,regular
Denoising Data with FFT [Python],https://www.youtube.com/watch?v=s2K1JfNR7Sc,regular
Denoising Data with FFT [Matlab],https://www.youtube.com/watch?v=c249W6uc7ho,regular
The Fast Fourier Transform Algorithm,https://www.youtube.com/watch?v=toj_IoCQE-4,regular
The Fast Fourier Transform (FFT),https://www.youtube.com/watch?v=E8HeD-MUrjY,regular
The Bitter Lockdown: A stop motion recipe for an exceptional hot toddy,https://www.youtube.com/watch?v=yon8iO0nW3I,regular
Computing the DFT Matrix,https://www.youtube.com/watch?v=Xw4voABxU5c,regular
The Discrete Fourier Transform (DFT),https://www.youtube.com/watch?v=nl9TZanwbBk,regular
Solving the Heat Equation with the Fourier Transform,https://www.youtube.com/watch?v=7haZCrQDHpA,regular
Parseval's Theorem,https://www.youtube.com/watch?v=ML0eYMyhqOs,regular
The Fourier Transform and Convolution Integrals,https://www.youtube.com/watch?v=mOiY1fOROOg,regular
The Fourier Transform and Derivatives,https://www.youtube.com/watch?v=d5d0ORQHNYs,regular
The Fourier Transform,https://www.youtube.com/watch?v=jVYs-GTqm5U,regular
Fourier Series and Gibbs Phenomena [Python],https://www.youtube.com/watch?v=sSvj1nCC6_o,regular
Fourier Series and Gibbs Phenomena [Matlab],https://www.youtube.com/watch?v=98VixA3MjAc,regular
Fourier Series [Matlab],https://www.youtube.com/watch?v=PP5ox7evg7o,regular
Fourier Series [Python],https://www.youtube.com/watch?v=dZrShAGqT44,regular
Complex Fourier Series,https://www.youtube.com/watch?v=4cfctnaHyFM,regular
Inner Products in Hilbert Space,https://www.youtube.com/watch?v=g-eNeXlZKAQ,regular
Fourier Series: Part 2,https://www.youtube.com/watch?v=Ud9Xtxsi2HI,regular
Fourier Series: Part 1,https://www.youtube.com/watch?v=MB6XGQWLV04,regular
Fourier Analysis: Overview,https://www.youtube.com/watch?v=jNC0jxb0OxE,regular
Identifying Dominant Balance Physics from Data - Jared Callaham,https://www.youtube.com/watch?v=U6eZOzHLSM0,regular
Randomized SVD Code [Python],https://www.youtube.com/watch?v=vDSi271vUWk,regular
Randomized SVD Code [Matlab],https://www.youtube.com/watch?v=AFyfEqh6g3I,regular
SVD: Importance of Alignment [Python],https://www.youtube.com/watch?v=5s2XU6FHoCs,regular
SVD: Importance of Alignment [Matlab],https://www.youtube.com/watch?v=OaCmD08xxGw,regular
SVD: Optimal Truncation [Python],https://www.youtube.com/watch?v=epoHE2rex0g,regular
SVD: Optimal Truncation [Matlab],https://www.youtube.com/watch?v=u4LG9z4AAdM,regular
SVD: Eigenfaces 3 [Python],https://www.youtube.com/watch?v=SsNXg6KpLSU,regular
SVD: Eigenfaces 2 [Python],https://www.youtube.com/watch?v=yYdYrAKghF4,regular
SVD: Eigenfaces 1 [Python],https://www.youtube.com/watch?v=ofWji_wQBEE,regular
SVD: Eigen Action Heros [Matlab],https://www.youtube.com/watch?v=SD4NfEKZ_p8,regular
SVD: Eigenfaces 4 [Matlab],https://www.youtube.com/watch?v=0y1LzRhQ4-I,regular
SVD: Eigenfaces 3 [Matlab],https://www.youtube.com/watch?v=dN4hIUhjUt0,regular
SVD: Eigenfaces 2 [Matlab],https://www.youtube.com/watch?v=I6cmIKIdROU,regular
SVD: Eigenfaces 1 [Matlab],https://www.youtube.com/watch?v=XwTW_YA3HG0,regular
Principal Component Analysis (PCA) 2 [Python],https://www.youtube.com/watch?v=fu7uXxZMzC8,regular
Principal Component Analysis (PCA) 1 [Python],https://www.youtube.com/watch?v=Oi4SJqJIL2E,regular
Principal Component Analysis (PCA) [Matlab],https://www.youtube.com/watch?v=VqjJ5YYt78Y,regular
Linear Regression 3 [Python],https://www.youtube.com/watch?v=vNjLugdaGvs,regular
Linear Regression 2 [Python],https://www.youtube.com/watch?v=88_wgLgx0_k,regular
Linear Regression 1 [Python],https://www.youtube.com/watch?v=q6ksri0LeDE,regular
Linear Regression 2 [Matlab],https://www.youtube.com/watch?v=_HTjxl_sdUA,regular
Linear Regression 1 [Matlab],https://www.youtube.com/watch?v=AX_ZDX6aTT0,regular
Unitary Transformations and the SVD [Python],https://www.youtube.com/watch?v=MJAvyt9v0g4,regular
Unitary Transformations and the SVD [Matlab],https://www.youtube.com/watch?v=_wOt50VnJw4,regular
SVD: Image Compression [Python],https://www.youtube.com/watch?v=H7qMMudo3e8,regular
SVD: Image Compression [Matlab],https://www.youtube.com/watch?v=QQ8vxj-9OfQ,regular
Randomized SVD: Power Iterations and Oversampling,https://www.youtube.com/watch?v=UXXMbpLI7AM,regular
Randomized Singular Value Decomposition (SVD),https://www.youtube.com/watch?v=fJ2EyvR85ro,regular
SVD and Alignment: A Cautionary Tale,https://www.youtube.com/watch?v=qfZcTtjBTSA,regular
SVD and Optimal Truncation,https://www.youtube.com/watch?v=9vJDjkx825k,regular
Principal Component Analysis (PCA),https://www.youtube.com/watch?v=fkf4IBRSeEc,regular
Linear Regression,https://www.youtube.com/watch?v=EDPCsD6BzWE,regular
"Linear Systems of Equations, Ax=b",https://www.youtube.com/watch?v=N9uf0YGDaWk,regular
Least Squares Regression and the SVD,https://www.youtube.com/watch?v=02QCtHM1qb4,regular
"Linear Systems of Equations, Least Squares Regression, Pseudoinverse",https://www.youtube.com/watch?v=PjeOmOz9jSY,regular
Unitary Transformations,https://www.youtube.com/watch?v=46Hpy4FiGls,regular
Matrix Completion and the Netflix Prize,https://www.youtube.com/watch?v=sooj-_bXWgk,regular
SVD Method of Snapshots,https://www.youtube.com/watch?v=rs63fnUWJkk,regular
The Frobenius Norm for Matrices,https://www.youtube.com/watch?v=Gt56YxMBlVA,regular
Singular Value Decomposition (SVD): Dominant Correlations,https://www.youtube.com/watch?v=WmDnaoY2Ivs,regular
Singular Value Decomposition (SVD): Matrix Approximation,https://www.youtube.com/watch?v=xy3QyyhiuY4,regular
Singular Value Decomposition (SVD): Mathematical Overview,https://www.youtube.com/watch?v=nbBvuuNVfco,regular
Singular Value Decomposition (SVD): Overview,https://www.youtube.com/watch?v=gXbThCXjZFM,regular
Intro to Data Science: What is Data Science?,https://www.youtube.com/watch?v=FsSrzmRawUg,regular
Digital Twins,https://www.youtube.com/watch?v=YqTL8dwYT54,regular
Neural Networks: Caveats,https://www.youtube.com/watch?v=6VEPQ_jOJ-Q,regular
Neural Networks and Deep Learning,https://www.youtube.com/watch?v=LvHEmisvl6w,regular
Neural Network Architectures & Deep Learning,https://www.youtube.com/watch?v=oJNHXPs0XDk,regular
Neural Network Overview,https://www.youtube.com/watch?v=aIZtJqtzdQs,regular
Artificial Intelligence,https://www.youtube.com/watch?v=rBmwRyshbOc,regular
Types of Machine Learning 2,https://www.youtube.com/watch?v=0_lKUPYEYyY,regular
Types of Machine Learning 1,https://www.youtube.com/watch?v=YlGEQyEM_a8,regular
Machine Learning and Cross-Validation,https://www.youtube.com/watch?v=CBHaInynRzU,regular
Machine Learning Goals,https://www.youtube.com/watch?v=ofM8LE9Zeaw,regular
Machine Learning Overview,https://www.youtube.com/watch?v=QpzQYDcczRQ,regular
Intro to Data Science: The Nature of Data,https://www.youtube.com/watch?v=OAB2bHsee9Y,regular
Intro to Data Science: Answering Questions with Data,https://www.youtube.com/watch?v=RDFkhLAeH2s,regular
Intro to Data Science: Historical Context,https://www.youtube.com/watch?v=aECk8s0FS7Q,regular
Intro to Data Science: Overview,https://www.youtube.com/watch?v=pzo13OPXZS4,regular
Simulating the Logistic Map in Matlab,https://www.youtube.com/watch?v=_BvAkyuWhOI,regular
Discrete-Time Dynamical Systems,https://www.youtube.com/watch?v=0dvF2jesB4E,regular
Simulating the Lorenz System in Matlab,https://www.youtube.com/watch?v=EnsB1wP3LFM,regular
Koopman Spectral Analysis (Multiscale systems),https://www.youtube.com/watch?v=J1MIaTdOL5A,regular
Koopman Spectral Analysis (Continuous Spectrum),https://www.youtube.com/watch?v=JJaxltAN9Ug,regular
Koopman Spectral Analysis (Control),https://www.youtube.com/watch?v=dx2f4exDZnU,regular
Koopman Spectral Analysis (Representations),https://www.youtube.com/watch?v=--J7F6khJD0,regular
Koopman Spectral Analysis (Overview),https://www.youtube.com/watch?v=J7s0XNT96ag,regular
Dynamic Mode Decomposition (Code),https://www.youtube.com/watch?v=kVbEHH_laNU,regular
Dynamic Mode Decomposition (Examples),https://www.youtube.com/watch?v=wheHQAhJWco,regular
Dynamic Mode Decomposition (Overview),https://www.youtube.com/watch?v=sQvrK8AGCAo,regular
Data-Driven Dynamical Systems Overview,https://www.youtube.com/watch?v=Kap3TZwAsv0,regular
"Machine Learning: What is easy, medium, and hard?",https://www.youtube.com/watch?v=5ket_A4BpDg,regular
Control systems with non-minimum phase dynamics,https://www.youtube.com/watch?v=7GjnvuKeWI8,regular
Extremum Seeking Control Applications,https://www.youtube.com/watch?v=-mD3bGD3Nbc,regular
Extremum Seeking Control: Challenging Example,https://www.youtube.com/watch?v=VTBl4f_ESFY,regular
Extremum Seeking Control in Simulink,https://www.youtube.com/watch?v=Iat_fcIA3_Y,regular
Extremum Seeking Control in Matlab,https://www.youtube.com/watch?v=6VUYWa3OCgg,regular
Extremum Seeking Control,https://www.youtube.com/watch?v=hxY-IWByn-Q,regular
Machine Learning Control: Genetic Programming Control,https://www.youtube.com/watch?v=6KNuJn6dVy4,regular
Machine Learning Control: Genetic Programming,https://www.youtube.com/watch?v=K2Hl7m2Ty_4,regular
Machine Learning Control: Tuning a PID Controller with Genetic Algorithms (Part 2),https://www.youtube.com/watch?v=Idl2wlnpDHU,regular
Machine Learning Control: Tuning a PID Controller with Genetic Algorithms,https://www.youtube.com/watch?v=S5C_z1nVaSg,regular
Machine Learning Control: Genetic Algorithms,https://www.youtube.com/watch?v=CZE86BPDqCI,regular
Machine Learning Control: Overview,https://www.youtube.com/watch?v=3yU2k8R9JeU,regular
Sparse Identification of Nonlinear Dynamics for Model Predictive Control,https://www.youtube.com/watch?v=MuT2ZzgS4DI,regular
Model Predictive Control,https://www.youtube.com/watch?v=YwodGM2eoy4,regular
System Identification: Sparse Nonlinear Models with Control,https://www.youtube.com/watch?v=vuJCOfdlN6Q,regular
System Identification: Koopman with Control,https://www.youtube.com/watch?v=6hgakq4yNL8,regular
System Identification: DMD Control Example,https://www.youtube.com/watch?v=tuPRiA5kk3w,regular
System Identification: Dynamic Mode Decomposition with Control,https://www.youtube.com/watch?v=K-7l0q920io,regular
System Identification: Regression Models,https://www.youtube.com/watch?v=7Hrqmz-mrZ8,regular
System Identification: Full-State Models with Control,https://www.youtube.com/watch?v=lPbl5HZqdL0,regular
Data-Driven Control: ERA/OKID Example in Matlab,https://www.youtube.com/watch?v=lE8H0Z8-Ez8,regular
Data-Driven Control: Observer Kalman Filter Identification,https://www.youtube.com/watch?v=TsdBeI6CKUM,regular
Data-Driven Control: Balanced Models with ERA,https://www.youtube.com/watch?v=7rIE7V1Xj2I,regular
Data-Driven Control: Eigensystem Realization Algorithm Procedure,https://www.youtube.com/watch?v=QDlWRWbFvhg,regular
Data-Driven Control: ERA and the Discrete-Time Impulse Response,https://www.youtube.com/watch?v=2HMv7Lx86K0,regular
Data-Driven Control: Eigensystem Realization Algorithm,https://www.youtube.com/watch?v=neTO1_RuLdU,regular
Data-Driven Control: Balanced Truncation and BPOD Example,https://www.youtube.com/watch?v=TSvijVOVtXs,regular
Data-Driven Control: BPOD and Output Projection,https://www.youtube.com/watch?v=jrk_kZdRFAo,regular
Data-Driven Control: Balanced Proper Orthogonal Decomposition,https://www.youtube.com/watch?v=1YfU0E1V60I,regular
Data-Driven Control: Error Bounds for Balanced Truncation,https://www.youtube.com/watch?v=8nDHVVmFqLU,regular
Data-Driven Control: Balanced Truncation Example,https://www.youtube.com/watch?v=oHLZM8u1vrs,regular
Data-Driven Control: Balanced Truncation,https://www.youtube.com/watch?v=RiwUoSgAejA,regular
Data-Driven Control: Balancing Transformation,https://www.youtube.com/watch?v=IlrnTjwujBk,regular
Data-Driven Control: Balancing Example,https://www.youtube.com/watch?v=sXV6NQzxl5g,regular
Data-Driven Control: Change of Variables in Control Systems (Correction),https://www.youtube.com/watch?v=M0ewnewuciY,regular
Data-Driven Control: Change of Variables in Control Systems,https://www.youtube.com/watch?v=i8v7cFIxonU,regular
Data-Driven Control: The Goal of Balanced Model Reduction,https://www.youtube.com/watch?v=FsLmBDfwQCY,regular
Data-Driven Control: Linear System Identification,https://www.youtube.com/watch?v=6F2YVsT9dOs,regular
Data-Driven Control: Overview,https://www.youtube.com/watch?v=oulLR06lj_E,regular
Control Bootcamp:  Cautionary Tale About Inverting the Plant Dynamics,https://www.youtube.com/watch?v=G9apWx4iaks,regular
Control Bootcamp:  Limitations on Robustness,https://www.youtube.com/watch?v=ReAmUJMb1d8,regular
Control Bootcamp:  Sensitivity and Robustness,https://www.youtube.com/watch?v=7lzH-HnUFZg,regular
Control Bootcamp:  Loop Shaping Example for Cruise Control,https://www.youtube.com/watch?v=fkYcCCujOjc,regular
Control Bootcamp:  Loop shaping,https://www.youtube.com/watch?v=sfNwLmgK5sE,regular
Control Bootcamp:  Sensitivity and Complementary Sensitivity (Part 2),https://www.youtube.com/watch?v=hEQdr1G5H2w,regular
Control Bootcamp:  Sensitivity and Complementary Sensitivity,https://www.youtube.com/watch?v=hTu36q5yx20,regular
Control Bootcamp:  Cruise Control Example with Proportional-Integral (PI) control,https://www.youtube.com/watch?v=vxTJMGqjGdg,regular
Control Bootcamp:  Benefits of Feedback on Cruise Control Example (Part 2),https://www.youtube.com/watch?v=-fNoz5K5FHA,regular
Control Bootcamp:  Benefits of Feedback on Cruise Control Example,https://www.youtube.com/watch?v=y4H03UOjlas,regular
Control Bootcamp:  Laplace Transforms and the Transfer Function,https://www.youtube.com/watch?v=0mnTByVKqLM,regular
Control Bootcamp:  Example Frequency Response (Bode Plot) for Spring-Mass-Damper,https://www.youtube.com/watch?v=e-8y4MTT7NQ,regular
Control Bootcamp:  Three Equivalent Representations of Linear Systems,https://www.youtube.com/watch?v=HasvumXl_vE,regular
Control Bootcamp:  Introduction to Robust Control,https://www.youtube.com/watch?v=Y6MRgg_TGy0,regular
Control Bootcamp:  LQG Example in Matlab,https://www.youtube.com/watch?v=reRT8LbPhBs,regular
Control Bootcamp:  Linear Quadratic Gaussian (LQG),https://www.youtube.com/watch?v=H4_hFazBGxU,regular
Control Bootcamp:  Kalman Filter Example in Matlab,https://www.youtube.com/watch?v=Lgq4R-F8SX8,regular
Control Bootcamp:  Observability Example in Matlab (Part 2),https://www.youtube.com/watch?v=DLytfA10RR8,regular
Control Bootcamp:  Observability Example in Matlab,https://www.youtube.com/watch?v=XBI_hQRqMvM,regular
The Kalman Filter [Control Bootcamp],https://www.youtube.com/watch?v=s_9InuQAx-g,regular
Control Bootcamp:  Full-State Estimation,https://www.youtube.com/watch?v=MZJMi-6_4UU,regular
Control Bootcamp:  Observability,https://www.youtube.com/watch?v=iRZmJBcg1ZA,regular
Motivation for Full-State Estimation [Control Bootcamp],https://www.youtube.com/watch?v=LTNMf8X21cY,regular
Linear Quadratic Regulator (LQR) Control for the Inverted Pendulum on a Cart [Control Bootcamp],https://www.youtube.com/watch?v=1_UobILf3cc,regular
Pole Placement for the Inverted Pendulum on a Cart [Control Bootcamp],https://www.youtube.com/watch?v=M_jchYsTZvM,regular
Inverted Pendulum on a Cart [Control Bootcamp],https://www.youtube.com/watch?v=qjhAAQexzLg,regular
Reachability and Controllability with Cayley-Hamilton [Control Bootcamp],https://www.youtube.com/watch?v=gpIhGAUoeNY,regular
Cayley-Hamilton Theorem [Control Bootcamp],https://www.youtube.com/watch?v=PrfxmkBsYKE,regular
Controllability and the PBH Test [Control Bootcamp],https://www.youtube.com/watch?v=0XJHgLrcPeA,regular
Degrees of Controllability and Gramians [Control Bootcamp],https://www.youtube.com/watch?v=ZNHx62HbKNA,regular
Controllability and the Discrete-Time Impulse Response [Control Bootcamp],https://www.youtube.com/watch?v=tnsWsMwYbEU,regular
"Controllability, Reachability, and Eigenvalue Placement [Control Bootcamp]",https://www.youtube.com/watch?v=FLByezr38Ps,regular
Controllability [Control Bootcamp],https://www.youtube.com/watch?v=u5Sv7YKAkt4,regular
Linearizing Around a Fixed Point [Control Bootcamp],https://www.youtube.com/watch?v=1YMTkELi3tE,regular
Stability and Eigenvalues [Control Bootcamp],https://www.youtube.com/watch?v=h7nJ6ZL4Lf0,regular
Linear Systems [Control Bootcamp],https://www.youtube.com/watch?v=nyqJJdhReiA,regular
Control Bootcamp: Overview,https://www.youtube.com/watch?v=Pi7l8mMjYVE,regular
Linear model for chaotic Lorenz system [HAVOK],https://www.youtube.com/watch?v=XHsYx1kpTXg,regular
Magnetic field reversal and Measles outbreaks: HAVOK models of chaos,https://www.youtube.com/watch?v=73xfX0dGdrY,regular
Hankel Alternative View of Koopman (HAVOK) Analysis [SHORT],https://www.youtube.com/watch?v=Q8VzAtGGlDQ,regular
Hankel Alternative View of Koopman (HAVOK) Analysis [FULL],https://www.youtube.com/watch?v=831Ell3QNck,regular
A Compressed Overview of Sparsity,https://www.youtube.com/watch?v=aHCyHbRIz44,regular
Compressed Sensing and Dynamic Mode Decomposition,https://www.youtube.com/watch?v=4tLSq_PEFms,regular
ME565 Lecture 26: Solving PDEs in Matlab using FFT,https://www.youtube.com/watch?v=eF5gVuR8C48,regular
ME565 Lecture 25: Laplace transform solutions to PDEs,https://www.youtube.com/watch?v=uL5VVB_6Gmw,regular
"ME565 Lecture 24: Convolution integrals, impulse and step responses",https://www.youtube.com/watch?v=4koVAJ33_so,regular
ME565 Lecture 23: Laplace Transform and ODEs with Forcing and Transfer Functions,https://www.youtube.com/watch?v=2MI2dNdX7jk,regular
ME565 Lecture 22:  Laplace Transform and ODEs,https://www.youtube.com/watch?v=5Ea1bNgnc7M,regular
ME565 Lecture 21: The Laplace Transform,https://www.youtube.com/watch?v=U6DQyTszGRI,regular
ME565 Lecture 20: Numerical Solutions to PDEs Using FFT,https://www.youtube.com/watch?v=v7BU6YOiAcE,regular
ME565 Lecture 19: Fourier Transform to Solve PDEs: 1D Heat Equation on Infinite Domain,https://www.youtube.com/watch?v=lURKzwwVjGo,regular
ME565 Lecture 18: FFT and Image Compression,https://www.youtube.com/watch?v=R-Qcd-a-DGA,regular
