title,link,type
Unboxing the Ultimate Z by HP Data Science Package (FIRST EVER HP Workstation w/ Data Science Stack),https://www.youtube.com/watch?v=YR9Faf1uZDg,regular
I Built the FIRST EVER YouTube Subscriber LEADERBOARD,https://www.youtube.com/watch?v=myhoWUrSP7o,regular
7 Things to Look For in a Masters For Data Science (feat. @TinaHuang1),https://www.youtube.com/watch?v=ji7DtgUeKCI,regular
6 Lessons from #66DaysOfData,https://www.youtube.com/watch?v=4039x4r-hGE,regular
Find a Data Science Project With These 3 Techniques,https://www.youtube.com/watch?v=yUrrf3Pm33s,regular
How I Chose My Masters Degree for Breaking into Data Science,https://www.youtube.com/watch?v=domVw8isGOI,regular
git for Data Science Made Simple... (Hopefully),https://www.youtube.com/watch?v=_0rHU6qAQe0,regular
The PODCAST you might have asked for?,https://www.youtube.com/watch?v=tnpV1etgcxs,regular
Dealing with Doubt in Data Science (My Impostor Syndrome Story),https://www.youtube.com/watch?v=Uf0dO-pgOrk,regular
Advice from a Data Analytics CEO (@How to Get an Analytics Job) - KNN EP. 17,https://www.youtube.com/watch?v=N97MhZEp2UQ,regular
Data Science Resume Round-Up With @Tina Huang  | Episode 3,https://www.youtube.com/watch?v=1Ir1NgCuI0Y,regular
5 Unusual Data Science Projects that Will Land You a Job,https://www.youtube.com/watch?v=d6FeV8WXPWY,regular
Sh*t Data Scientists Say (Parody),https://www.youtube.com/watch?v=WRF_dKZ_i24,regular
5 Proven Strategies to Break into a Data Science Job,https://www.youtube.com/watch?v=UpaEjBOMNqs,regular
Why Data-Viz is so Darn Important (@Story by Data | Kate Strachnyi) - KNN EP. 16,https://www.youtube.com/watch?v=UKuK2fXu_dU,regular
Data Science Resume Round-Up With @TinaHuang1  - Episode 1,https://www.youtube.com/watch?v=Ft4GVkQQtgk,regular
5 Essential Data Science Projects for Your Portfolio,https://www.youtube.com/watch?v=BBDiadC8BvE,regular
His Startup Will Land You a Data Science Job (Jeremie Harris) - KNN EP. 15,https://www.youtube.com/watch?v=7VcdvSyoxnc,regular
Reviewing Your Data Science Projects - Episode 21(The Cleanest Portfolio),https://www.youtube.com/watch?v=8Vxjp2KVHqs,regular
"Hedge Funds, Startups, and Data Science Oh my! (@DataLeap) - KNN EP. 14",https://www.youtube.com/watch?v=Kq9dkZu0bpg,regular
Land a Data Science Job in a Different Country (Vijay Pravin Maharajan) - KNN EP. 13,https://www.youtube.com/watch?v=omdhf8d53FM,regular
Reviewing Your Data Science Projects - Episode 20 (Bootcamp Capstone),https://www.youtube.com/watch?v=apf6A3Nstm8,regular
The 5 Pillars of Success I Live By,https://www.youtube.com/watch?v=jf3j0lWmFPU,regular
Fast Cars to Faster Data (Alex Castrounis) - KNN EP. 12,https://www.youtube.com/watch?v=g7on3Rw0Ovg,regular
Reviewing Your Data Science Projects - Episode 19 (One Big Improvement),https://www.youtube.com/watch?v=rLawTH--l2Y,regular
How I Learn Data Science Through Studying Other People's Code | #66DaysOfData,https://www.youtube.com/watch?v=-pdXWmj9xxU,regular
How She Dominated the FAANG Data Science Interview  (@TinaHuang1 ) - KNN EP. 11,https://www.youtube.com/watch?v=vfV4nm004VQ,regular
Reviewing Your Data Science Projects - Episode 18 (Job-Worthy GitHub),https://www.youtube.com/watch?v=oHUD2T_VXfI,regular
Why I'm Starting Data Science Over Again.,https://www.youtube.com/watch?v=uXLnbdHMf8w,regular
Inside the Mind of the Ultimate Kaggle Grandmaster (@Abhishek Thakur ) - KNN EP. 10,https://www.youtube.com/watch?v=5v_ulmGv-gc,regular
Reviewing Your Data Science Projects - Episode 17 (Best Portfolio Website Yet?),https://www.youtube.com/watch?v=q6Lf2yhvluw,regular
Don't Buy My Course..,https://www.youtube.com/watch?v=iGUiLWFDWfk,regular
How a Subscriber Landed a Data Analyst Job in Less Than a Year (Ray Ojel) - KNN EP. 09,https://www.youtube.com/watch?v=SsGKZe4dVyk,regular
Reviewing Your Projects - Episode 16 (Project Review for Beginners),https://www.youtube.com/watch?v=RAMxzqSMDKE,regular
Data Scientist Dismantles the YouTube Algorithm.,https://www.youtube.com/watch?v=YbTMIxjk4hI,regular
Sports Analytics & Streaming Data Science on Twitch (Nick Wan) - KNN EP. 08,https://www.youtube.com/watch?v=S_CuB__nsmI,regular
Reviewing Your Data Science Projects - Episode 15 (Quant Finance),https://www.youtube.com/watch?v=KEBVcVwFzaI,regular
The Plagiarism Problem in Data Science,https://www.youtube.com/watch?v=vQGJvmhpq_s,regular
Interview with the Director of AI Research @ NVIDIA (Anima Anandkumar) - KNN EP. 07,https://www.youtube.com/watch?v=Xgg7dIKys9E,regular
Reviewing Your Data Science Projects - Episode 14 [Deep Learning Focus],https://www.youtube.com/watch?v=UuR3nomI5AE,regular
My First Data Science Contracting Side-Gig (How I Did It),https://www.youtube.com/watch?v=6tQtwqthUMI,regular
Do You Have a Data Science Mentor? (@Danny Ma) - KNN EP. 06,https://www.youtube.com/watch?v=QN3wXPZSjpE,regular
Reviewing Your Data Science Projects - Episode 13 (BONUS LinkedIn Review),https://www.youtube.com/watch?v=rdo8YBasqqA,regular
Building a Deep Learning BEAST (NVIDIA TITAN RTX + RYZEN 3900X),https://www.youtube.com/watch?v=_rbrdNTpZGo,regular
Is it Important to Share Your Data Science Work? (Ft. Eric Weber),https://www.youtube.com/watch?v=ELFGsNqZrlM,regular
Reviewing Your Data Science Resumes - Episode 12 (3 Different Resumes!),https://www.youtube.com/watch?v=PWmxLYTixAM,regular
Beginner Kaggle Data Science Project Walk-Through (Titanic),https://www.youtube.com/watch?v=I3FBJdiExcg,regular
Uber Driver to Machine Learning Engineer in 9 Months! (@Daniel Bourke) - KNN EP. 05,https://www.youtube.com/watch?v=hO_YKK_0Qck,regular
Reviewing Your Data Science Projects - Episode 11(GITHUB CLEANING),https://www.youtube.com/watch?v=2KkrtG5IsHo,regular
The Best Computer for Data Science Beginners,https://www.youtube.com/watch?v=QQLToUlgN7A,regular
Should You Major in Data Science? (Jaemin Lee) - KNN EP. 04,https://www.youtube.com/watch?v=6aaIbd-GpZs,regular
Critiquing MY OWN Data Science Resume,https://www.youtube.com/watch?v=lsXWVPzwZPk,regular
Where to Start Learning Data Science,https://www.youtube.com/watch?v=AqPquogHwq0,regular
"Data Science Productivity, Motivation, and Organization (ft. Data Professor & Codebasics)",https://www.youtube.com/watch?v=742LQ38OioU,regular
Reviewing Your Data Science Projects - Episode 10 (Leveraging Your Data),https://www.youtube.com/watch?v=B1g_yMKpdwo,regular
How to Get a Data Science Job at FAANG (@Data Science Jay) - KNN EP. 03,https://www.youtube.com/watch?v=zGlJ-QndG8E,regular
Reviewing Your Data Science Projects - Episode 9 (Professional Violinist),https://www.youtube.com/watch?v=6fwyyRgZlD0,regular
Reviewing Your Data Science Projects - Episode 8 (College Student Help),https://www.youtube.com/watch?v=WnB1jsDu900,regular
Why You're Struggling to Learn Data Science,https://www.youtube.com/watch?v=XjC3FPL-S78,regular
Reviewing Your Data Science Projects - Episode 7 (Incredible Portfolio Website),https://www.youtube.com/watch?v=txR8_jGi0Ls,regular
The State of Data Science with Krish Naik & The Data Professor [Panel Discussion],https://www.youtube.com/watch?v=4qZINLzwYyk,regular
Reviewing Your Data Science Projects - Episode 6 (Only 3 months of coding experience),https://www.youtube.com/watch?v=mR2NCRgtLPE,regular
How to Build a Data Science Portfolio Website with Hugo & Github Pages [feat. Data Professor],https://www.youtube.com/watch?v=mEZ1Hj5yQ-8,regular
Reviewing Your Data Science Projects - Episode 5 (Very Detailed Project),https://www.youtube.com/watch?v=HJH0gfY6EUg,regular
Different Data Science Roles Explained (by a Data Scientist),https://www.youtube.com/watch?v=BZFfNwj7JhE,regular
Reviewing Your Data Science Projects - Episode 4 (Resume & Github),https://www.youtube.com/watch?v=_K6cNdgN3CI,regular
How to Make A Data Science Portfolio Website with Github Pages,https://www.youtube.com/watch?v=1aXk2RViq3c,regular
10000 Subscriber and 100th Video Special (Data Science),https://www.youtube.com/watch?v=UcilY6HDuL8,regular
Reviewing Your Data Science Projects - Episode 3 (Student Portfolio),https://www.youtube.com/watch?v=jam0xApfC-U,regular
How I Would Learn Data Science (If I Had to Start Over),https://www.youtube.com/watch?v=4OZip0cgOho,regular
Reviewing Your Data Science Projects - Episode 2 (Resume and Portfolio),https://www.youtube.com/watch?v=QBIe4nbmZfA,regular
What You Need to Know for a Data Science Internship,https://www.youtube.com/watch?v=KHAuuOQui2U,regular
Reviewing Your Data Science Projects - Episode 1 (Exploratory Analysis),https://www.youtube.com/watch?v=DW55gaQ_Egk,regular
What It's Like to be a Socially Distanced Data Scientist (A Day in the Life),https://www.youtube.com/watch?v=lUUqrRgerd8,regular
Data Science in Sports - Talk for Northwestern (Kellogg) MBA Students,https://www.youtube.com/watch?v=ei1m5lDQyBg,regular
5 Tips for Crushing the Work From Home Life,https://www.youtube.com/watch?v=9D7GzskcyUk,regular
Data Science Project from Scratch - Part 7 (Documenting Your Work),https://www.youtube.com/watch?v=agHKuUoMwvY,regular
Data Science Project from Scratch -  Part 6 (Putting the Model into Production),https://www.youtube.com/watch?v=nUOh_lDMHOU,regular
Data Science Project from Scratch  - Part 5 (Model Building),https://www.youtube.com/watch?v=7O4dpR9QMIM,regular
Data Science Project from Scratch - Part 4 (Exploratory Data Analysis),https://www.youtube.com/watch?v=QWgg4w1SpJ8,regular
Data Science Project from Scratch - Part 3 (Data Cleaning),https://www.youtube.com/watch?v=fhi4dOhmW-g,regular
Data Science Project from Scratch - Part 2 (Data Collection),https://www.youtube.com/watch?v=GmW4F6MHqqs,regular
Data Science Project from Scratch - Part 1 (Project Planning),https://www.youtube.com/watch?v=MpF9HENQjDo,regular
When Data Science Goes Wrong,https://www.youtube.com/watch?v=9ZwVqXUHf6o,regular
How to ULTRALEARN Data Science,https://www.youtube.com/watch?v=a3VWq9smqhM,regular
Why Right NOW is a Great Time to Learn Data Science,https://www.youtube.com/watch?v=oMdVg6GPODA,regular
Data Science Project Example Start to Finish (Deep Learning Image Classifier),https://www.youtube.com/watch?v=vy-R4oUZaC8,regular
The Secret Data Scientists Don't Want You to Know,https://www.youtube.com/watch?v=XGBigjVy2Eo,regular
The 5 Stages of Learning Data Science,https://www.youtube.com/watch?v=hpMc6TgT34I,regular
Can You Learn Data Science Without a Computer?,https://www.youtube.com/watch?v=Fs_LG5Y8GIU,regular
The Best Free Data Science Courses Nobody is Talking About,https://www.youtube.com/watch?v=Ip50cXvpWY4,regular
The Data Science Projects that Got Me a Job,https://www.youtube.com/watch?v=imMPnCHvbkY,regular
How to Integrate Data Science into Your Business,https://www.youtube.com/watch?v=3bes4U4MHPg,regular
The Problem with Data Science,https://www.youtube.com/watch?v=qP0hRF-lGqg,regular
How Much Did Cheating Help the Astros Win? (What the Numbers Say),https://www.youtube.com/watch?v=aaAZXeuPIXk,regular
How to Set Up Your Data Science Environment (Anaconda Beginner),https://www.youtube.com/watch?v=C4OPn58BLaU,regular
3 Proven Data Science Projects for Beginners (Kaggle),https://www.youtube.com/watch?v=8igH8qZafpo,regular
Data Science Advice for College Students,https://www.youtube.com/watch?v=xjhW1rSQeik,regular
Avoid These Data Science Resume Mistakes!,https://www.youtube.com/watch?v=DM1eE_Coh6g,regular
Data Science Explained with ... Cooking?,https://www.youtube.com/watch?v=f6NPw582FFc,regular
The 4 Types of Sports Analytics Projects,https://www.youtube.com/watch?v=dlZWB2D-NaQ,regular
Data Science in Golf: PGA Merchandise Show 2020,https://www.youtube.com/watch?v=foggudmDDvY,regular
How I Learned Data Science,https://www.youtube.com/watch?v=n3vw0M5RrPU,regular
What is Sports Analytics Really?,https://www.youtube.com/watch?v=2OnXytYziF0,regular
Data Science Certificate vs Bootcamp vs Masters Degree,https://www.youtube.com/watch?v=Q9FjwzKFPuM,regular
How To Learn Programming for Data Science [3 Steps],https://www.youtube.com/watch?v=VN12ZPFsApM,regular
Data Science Fundamentals: SQL Queries,https://www.youtube.com/watch?v=WKXtTo7lqmA,regular
Questions You Should Ask Your Data Science Interviewers,https://www.youtube.com/watch?v=9-2OKLZfvbE,regular
The 9 Books That Changed My Perspective in 2019,https://www.youtube.com/watch?v=3TrAYmrmA8o,regular
The Data Science Interview: What to Expect,https://www.youtube.com/watch?v=5SjK6YCs4o4,regular
5 Data Science Resolutions for 2020,https://www.youtube.com/watch?v=iqG59TqfFdY,regular
How to Scrape NBA Data Using the nba_api Python Module,https://www.youtube.com/watch?v=NCyPY-jfb3I,regular
Collision Course: Sports Betting + Data Science,https://www.youtube.com/watch?v=DopikusDfk0,regular
3 Reasons You Should NOT Become a Data Scientist,https://www.youtube.com/watch?v=m5pwx3hgtzM,regular
5 Sports Analytics Books to Get You Started,https://www.youtube.com/watch?v=74Z3F7i4qcI,regular
Math Needed for Mastering Data Science,https://www.youtube.com/watch?v=zSwM5uVeylU,regular
The 5 Stages of Data Science Adoption,https://www.youtube.com/watch?v=BXmEmIK5aqI,regular
How YOU Can Land a Sports Analytics Job,https://www.youtube.com/watch?v=SLC5sPZSLY4,regular
Data Science Fundamentals: Linear Regression,https://www.youtube.com/watch?v=EAezvs0eL1s,regular
Golf: Would You Rather Be the LONGEST or STRAIGHTEST Driver on the PGA Tour?,https://www.youtube.com/watch?v=k4r_NtB4JVQ,regular
Sports Analytics 101: The Pythagorean Theorem of Sports,https://www.youtube.com/watch?v=ZWdyBbgGZBQ,regular
9 Ways You Can Make Extra Income as a Data Scientist,https://www.youtube.com/watch?v=1FrY7ARSf10,regular
Applying Data Science To My YouTube Data: My Surprising Findings,https://www.youtube.com/watch?v=LGEuDWjWQes,regular
Why Selling Is An Important Data Science Skill,https://www.youtube.com/watch?v=fjVVtvp5X0w,regular
By The Numbers: Where Should The NBA Put a 4 Point Line?,https://www.youtube.com/watch?v=-kX2b6TF_9k,regular
Why is Balance Important in Data Science?,https://www.youtube.com/watch?v=3ysXGYjvbSU,regular
How to Stay Productive & Motivated When Learning Data Science,https://www.youtube.com/watch?v=akbU9KOo_Qc,regular
How Far Should the NBA 3-Point Line Actually Be?,https://www.youtube.com/watch?v=3BEtGaz70rQ,regular
6 Habits of Successful Data Scientists,https://www.youtube.com/watch?v=RRXWJVX0fE8,regular
How To Build A Word Cloud From Scraped Data (Python),https://www.youtube.com/watch?v=k-gin1qfzi0,regular
Thank You For The Support | What's Next | Ken Jee | Data Science,https://www.youtube.com/watch?v=Zz_Mx1UPswI,regular
Is Data Science Right For You?,https://www.youtube.com/watch?v=3Mm1U1CbzNw,regular
Data Science Fundamentals: Data Cleaning in Python,https://www.youtube.com/watch?v=4yI3vVe0Jos,regular
How To Get Data Science Experience (Without a Job),https://www.youtube.com/watch?v=pWVQ0vN5uig,regular
Take Your Data Science Projects From Good to Great,https://www.youtube.com/watch?v=a-Syoa9mPhM,regular
The Projects You Should Do To Get A Data Science Job,https://www.youtube.com/watch?v=yukdXV9LR48,regular
What Does a Data Scientist Actually Do?,https://www.youtube.com/watch?v=XWetgrNas-k,regular
Data Science Fundamentals: Data Manipulation in Python (Pandas),https://www.youtube.com/watch?v=yIJrCFXs0rU,regular
Data Science Fundamentals: Data Exploration in Python (Pandas),https://www.youtube.com/watch?v=Z9dGmL2G-4k,regular
Data Science: Pros and Cons,https://www.youtube.com/watch?v=T7BQJJIGrmc,regular
How I Got My First Data Science Internship (And How You Can Land One),https://www.youtube.com/watch?v=T77uVbLhroQ,regular
My Top 5 Data Science Internship Tips,https://www.youtube.com/watch?v=1Cf7SdnBncg,regular
Golf STATS: Strokes Gained Explained,https://www.youtube.com/watch?v=3cDM9Z-fdz4,regular
Most Data Science Hopefuls Overlook This Important Skill,https://www.youtube.com/watch?v=Yr5T3T4tq-g,regular
What I Learned From My Three Degrees,https://www.youtube.com/watch?v=KMOA5arCi8g,regular
I Wish I Had Known THIS Before Starting in Data Science,https://www.youtube.com/watch?v=Z_KFh-HqaBA,regular
NASA Physicist Turned Data Scientist (Tim Bowling) - KNN EP. 02,https://www.youtube.com/watch?v=5jntoZX-Tc8,regular
Should You Learn R for Data Science?,https://www.youtube.com/watch?v=AxP1CL0yaFQ,regular
Scrape Twitter Data in Python with Twitterscraper Module,https://www.youtube.com/watch?v=zF_Q2v_9zKY,regular
Work From Home Data Scientist: Day in the Life,https://www.youtube.com/watch?v=4CpmB4TR2C4,regular
Where to Look for Data Science Jobs,https://www.youtube.com/watch?v=6sJEnzDjJqI,regular
Data Science: Startup vs. Large Corporation,https://www.youtube.com/watch?v=1UjMBw_7Gi8,regular
"Data Science, Machine Learning, and AI: What's the Difference?",https://www.youtube.com/watch?v=q8cEt8gj3zY,regular
Was Captain Marvel Bad? A Sentiment Analysis of Twitter Data,https://www.youtube.com/watch?v=_CS4u9cORwA,regular
Why You DON'T Want to be a WFH Data Scientist,https://www.youtube.com/watch?v=XTrlMQXYqts,regular
Welcome To My Channel | Ken Jee | Data Science,https://www.youtube.com/watch?v=smeFkHwnM_k,regular
Where YOU Should Start With Data Science Projects,https://www.youtube.com/watch?v=sq5TnVJWv6A,regular
Watch This Before Applying to Data Science Jobs,https://www.youtube.com/watch?v=XoUyK3XHZHs,regular
My Top 5 Data Science Resources for 2019,https://www.youtube.com/watch?v=tv1e22u2COk,regular
IT'S NOT TOO LATE TO LEARN CODE!,https://www.youtube.com/watch?v=j-Z-je6K4Yg,regular
The Best Way to Predict NBA Minutes Played,https://www.youtube.com/watch?v=sCOX5yShmFA,regular
Demystifying Data Science Roles,https://www.youtube.com/watch?v=FBgs-BSTIJE,regular
How to Simulate NBA Games in Python,https://www.youtube.com/watch?v=irjTWNV0eAY,regular
Should You Get A Masters in Data Science?,https://www.youtube.com/watch?v=RRSRKf9eQxc,regular
How I Became A Data Scientist From a Business Background,https://www.youtube.com/watch?v=IFceyuL6GZY,regular
Predicting Season Long NBA Wins Using Multiple Linear Regression,https://www.youtube.com/watch?v=Y_SMU701qlA,regular
Predicting Crypto-Currency Price Using RNN lSTM & GRU,https://www.youtube.com/watch?v=qfRhKHV8-t4,regular
Is Your Phone Actually Listening to You? #shorts,https://www.youtube.com/shorts/1RUj2aLQx8I,shorts
How I Realized I Was a Bad Manager #shorts,https://www.youtube.com/shorts/MkzZXSw1Glk,shorts
Why I Quit Data Science... and then crawled back #shorts,https://www.youtube.com/shorts/UaNNVukM27g,shorts
The Best Place to Look for Data Science Opportunities #shorts,https://www.youtube.com/shorts/3lN0-S3symM,shorts
Learning On the companies dime #shorts,https://www.youtube.com/shorts/M-AN8eWLxms,shorts
The Best Way to Transition to Data Science? #shorts,https://www.youtube.com/shorts/MXFZhbvQqM8,shorts
Avoid this Massive Data Science Learning Mistake #shorts,https://www.youtube.com/shorts/54n61XjKifI,shorts
Don't Go into Data for the Money #shorts,https://www.youtube.com/shorts/pyWYIRR8rrE,shorts
How to Approach Applying for a Data Role #shorts,https://www.youtube.com/shorts/u6P23ouSYhA,shorts
The Hard Reality of Data Science Work #shorts,https://www.youtube.com/shorts/RMMVuvS7S_g,shorts
How Much Money Does a Data Scientist Make? #shorts,https://www.youtube.com/shorts/5AwbPAV8FS0,shorts
These 3 Things Make Data Science Special #shorts,https://www.youtube.com/shorts/A2OQgU0IRNo,shorts
Will Data Science Be Automated? #shorts,https://www.youtube.com/shorts/x5Q_nrIqFik,shorts
Is Data Science A Good Fit For You? #shorts,https://www.youtube.com/shorts/7ja2ELBVMlU,shorts
How To Start Working on Data Science Projects (As a Beginner) #shorts,https://www.youtube.com/shorts/JTlB9fwYRk0,shorts
What Data Science Tool Would I Learn First? #shorts,https://www.youtube.com/shorts/OJDf_fTENJ4,shorts
How long does it take to become a Data Scientist? #shorts,https://www.youtube.com/shorts/nqCkdqhV-JY,shorts
Where & how to start your Data Science Journey #shorts,https://www.youtube.com/shorts/b8t8lDL13sg,shorts
IRON ANALYST (Teaser) #shorts,https://www.youtube.com/shorts/nRHPQ5ZeB5Y,shorts
Should  @LukeBarousse Take This Data Analyst Job? (Funny) #Shorts,https://www.youtube.com/shorts/2RWwN5ZT4tA,shorts
How Statistics Saved the US SERIOUS $$$$ During WW2 #Shorts,https://www.youtube.com/shorts/scSc6YSanQ0,shorts
Project Presentation - Expectations vs. Reality (funny) #shorts,https://www.youtube.com/shorts/VvnOXDCVm8k,shorts
Data Science Project - Expectations vs Reality (funny) #shorts,https://www.youtube.com/shorts/68GGPK3WaqI,shorts
Is Spotify Shuffle Really Random? #Shorts,https://www.youtube.com/shorts/tG_UW_p0UqE,shorts
#66DaysOfData - 3 Reasons to Start!,https://www.youtube.com/shorts/sICJ6a2wX5g,shorts
#66DaysOfData - What is it? #shorts,https://www.youtube.com/shorts/iiSZqsQKNX8,shorts
A Quick Data Science Project Tip! #SHORTS,https://www.youtube.com/shorts/IoUWD1h6xUs,shorts
What is a lambda function (python)? #shorts,https://www.youtube.com/shorts/SaWxVk7rDp4,shorts
Why Kaggle Should Be Your Favorite Data Science Resource #shorts,https://www.youtube.com/shorts/n7kjelw9s2w,shorts
What is Pandas? (Data & Data Science) #shorts,https://www.youtube.com/shorts/8Pi36Nj6P9A,shorts
�� Hot Topics in Tech: Data Science Explained #SHORTS,https://www.youtube.com/shorts/OtqQYqRNDGI,shorts
State of Data Science - Web Data,https://www.youtube.com/watch?v=oNvyvYGw5n4,live
Data Science Town Hall - State of Data Science,https://www.youtube.com/watch?v=GaZRuchRCyw,live
State of Data Science (Town Hall) ft - Data Squad,https://www.youtube.com/watch?v=bBJd0oPdNak,live
#66DaysOfData Round 3 Live Event! (feat. @statquest),https://www.youtube.com/watch?v=qUK5Vk4NvBw,live
I Eat a Papaya Live on Stream (Plus Q&A for 150K Subs!),https://www.youtube.com/watch?v=143WWA5Sy9k,live
100K Channel Update + AMA Stream!,https://www.youtube.com/watch?v=78LjdAAw0wA,live
"Ken Jee Q & A Live Stream (50,000 Sub Special!)",https://www.youtube.com/watch?v=-3d1NctSv0c,live
Become a DATA ANALYST after this CERTIFICATE? Google Data Analytics Certificate,https://www.youtube.com/watch?v=HZcwkWlspNA,regular
FASTEST Way To Become A Data Analyst - GUARANTEED Job,https://www.youtube.com/watch?v=PTfssYLJoks,regular
Build Data Analyst Portfolio from Scratch In 3 Days (Job Ready),https://www.youtube.com/watch?v=IxzFaEfUfG4,regular
Best Deep Learning Certificate For Machine Learning Review (2023),https://www.youtube.com/watch?v=c2qT-naW3M8,regular
Is the IBM Data Science Certificate STILL Worth It? (2023),https://www.youtube.com/watch?v=lNX5FvSH2NE,regular
Is Harvard CS50 Still Worth It? (2023),https://www.youtube.com/watch?v=rmX_hKZ-D5U,regular
Is The IBM Data Analyst Certificate STILL Worth It? (2023),https://www.youtube.com/watch?v=zwxquFynvjQ,regular
Learn To CODE Playing This Free Game (Codecademy),https://www.youtube.com/watch?v=lbqXlsEQRhI,regular
Google Digital Marketing & E-Com Certificate - Still Worth It?,https://www.youtube.com/watch?v=uPFPS03W6p8,regular
Don't get the Google IT Support Certificate if this is you,https://www.youtube.com/watch?v=JObvMwebFfg,regular
Google's FREE Python Certificate (Detailed Guide),https://www.youtube.com/watch?v=b8j1VRlIiBo,regular
The Problem With Entry Level Jobs In 2023 (Do This Instead),https://www.youtube.com/watch?v=qXSudNpUVTA,regular
Google vs IBM IT Support Certificate (BEST Certificate For IT Jobs 2023),https://www.youtube.com/watch?v=xNJZ6_5lAi0,regular
Google UX Design Professional Certificate - Worth It? Can you get a job?,https://www.youtube.com/watch?v=XlXARwOYiDM,regular
Google Project Management Professional Certificate (Job Without College),https://www.youtube.com/watch?v=Kdq7ytXxPnI,regular
The 10 most useless degrees in 2023…,https://www.youtube.com/watch?v=kAlLzsT3Ovc,regular
The 10 degrees that make the most millionaries (2022),https://www.youtube.com/watch?v=_THPKBw0opg,regular
Google IT Support Professional Certificate - Worth it? Can you get a job?,https://www.youtube.com/watch?v=OGuyox6RbF8,regular
Google IT Automation Python Professional Certificate! Worth It? Can you get a job?,https://www.youtube.com/watch?v=DqmITU-Rhxs,regular
Make $100K/YR With Free Google Certifications - THE TRUTH,https://www.youtube.com/watch?v=xyaQmD4XK8g,regular
FREE US College Degree In 2023 (The Truth),https://www.youtube.com/watch?v=Rd60TgWUI1Q,regular
Google Data Analytics Review,https://www.youtube.com/watch?v=J9DW9Jr9mkM,regular
"I analyzed 555,440 jobs to solve THIS",https://www.youtube.com/watch?v=7G_Kz5MOqps,regular
How I use Python as a Data Analyst,https://www.youtube.com/watch?v=iNEwkaYmPqY,regular
THEY became Data Analysts with NO degree,https://www.youtube.com/watch?v=vRbgun8ryVE,regular
Tools you should know as a Data Analyst,https://www.youtube.com/watch?v=0R1LCYpiQsw,regular
How I use Machine Learning as a Data Analyst,https://www.youtube.com/watch?v=AopGnnPPczY,regular
How I use Math as a Data Analyst,https://www.youtube.com/watch?v=tBfIh3VQX2o,regular
Data Analyst vs. Data Scientist (funny!),https://www.youtube.com/watch?v=i8PKI_zJfDU,regular
How I use Excel as a Data Analyst,https://www.youtube.com/watch?v=lw6sPHH7twk,regular
PROJECTS that landed Data Jobs for my Subscribers,https://www.youtube.com/watch?v=5Q0gB7imNOo,regular
They became Data Analysts with THIS - Google Data Analytics Certificate: One Year Later,https://www.youtube.com/watch?v=MSlIfGSI6bo,regular
How I find projects as a Data Analyst,https://www.youtube.com/watch?v=NQSe-SuykJU&t,regular
How I learned how to learn,https://www.youtube.com/watch?v=W5qAY4XidHE&t,regular
The book every Data Analyst should read,https://www.youtube.com/watch?v=09JnFEdZe2A&t,regular
How I use SQL as a Data Analyst,https://www.youtube.com/watch?v=GEBzsz8ZSXs,regular
Why you should NOT be a Data Analyst,https://www.youtube.com/watch?v=NAuuqdzC_rI,regular
How I Would Learn to be a Data Analyst,https://www.youtube.com/watch?v=CC66RXeTn_4&t,regular
Top Courses to Become a Data Analyst,https://www.youtube.com/watch?v=aqRxZSrJLEc&t,regular
