title,link,type
Neural Networks Part 6: Cross Entropy,https://www.youtube.com/watch?v=6ArSys5qHAU,regular
"The SoftMax Derivative, Step-by-Step!!!",https://www.youtube.com/watch?v=M59JElEPgIg,regular
Neural Networks Part 5: ArgMax and SoftMax,https://www.youtube.com/watch?v=KpKog-L9veg,regular
Neural Networks Pt. 4: Multiple Inputs and Outputs,https://www.youtube.com/watch?v=83LYR-1IcjA,regular
US Census Data and Contest!!!,https://www.youtube.com/watch?v=0nK6iPpqNPU,regular
Neural Networks Pt. 3: ReLU In Action!!!,https://www.youtube.com/watch?v=68BZ5f7P94E,regular
Backpropagation Details Pt. 2: Going bonkers with The Chain Rule,https://www.youtube.com/watch?v=GKZoOHXGcLo,regular
Backpropagation Details Pt. 1: Optimizing 3 parameters simultaneously.,https://www.youtube.com/watch?v=iyn2zdALii8,regular
Neural Networks Pt. 2: Backpropagation Main Ideas,https://www.youtube.com/watch?v=IN2XmBhILt4,regular
What is AutoML? A conversation with Gnosis Data Analysis,https://www.youtube.com/watch?v=SEwxvjfxxmE,regular
Neural Networks Pt. 1: Inside the Black Box,https://www.youtube.com/watch?v=CqOfi41LfDw,regular
XGBoost in Python from Start to Finish,https://www.youtube.com/watch?v=GrJP9FLV3FE,regular
The Elements of StatQuest (Webinar),https://www.youtube.com/watch?v=Y5tyrAxhmUc,regular
The Chain Rule,https://www.youtube.com/watch?v=wl1myxrtQHQ,regular
"Hypothesis Testing and The Null Hypothesis, Clearly Explained!!!",https://www.youtube.com/watch?v=0oc49DyA3hU,regular
Alternative Hypotheses: Main Ideas!!!,https://www.youtube.com/watch?v=5koKb5B_YWo,regular
Support Vector Machines in Python from Start to Finish.,https://www.youtube.com/watch?v=8A7L0GsBiLQ,regular
Classification Trees in Python from Start to Finish,https://www.youtube.com/watch?v=q90UDEgYqeI,regular
"Gaussian Naive Bayes, Clearly Explained!!!",https://www.youtube.com/watch?v=H3EjCKtlVog,regular
"Naive Bayes, Clearly Explained!!!",https://www.youtube.com/watch?v=O2L2Uv9pdDA,regular
"Ridge vs Lasso Regression, Visualized!!!",https://www.youtube.com/watch?v=Xm2C_gTAl8c,regular
Live 2020-05-04!!! Conditional Probability,https://www.youtube.com/watch?v=iiN_J9S0KLM,regular
"Statistical Power, Clearly Explained!!!",https://www.youtube.com/watch?v=Rsc5znwR5FA,regular
"Power Analysis, Clearly Explained!!!",https://www.youtube.com/watch?v=VX_M3tIyiYk,regular
p-hacking: What it is and how to avoid it!,https://www.youtube.com/watch?v=HDCOUXE3HMM,regular
Live 2020-04-20!!! Expected Values,https://www.youtube.com/watch?v=fU2PuYKsr6M,regular
Bam!!! Clearly Explained!!!,https://www.youtube.com/watch?v=i4iUvjsGCMc,regular
How to calculate p-values,https://www.youtube.com/watch?v=JQc3yx0-Q9E,regular
p-values: What they are and how to interpret them,https://www.youtube.com/watch?v=vemZtEM63GY,regular
XGBoost Part 4 (of 4): Crazy Cool Optimizations,https://www.youtube.com/watch?v=oRrKeUCEbq8,regular
XGBoost Part 3 (of 4): Mathematical Details,https://www.youtube.com/watch?v=ZVFeW798-2I,regular
StatQuest: Random Forests Part 2: Missing data and clustering,https://www.youtube.com/watch?v=sQ870aTKqiM,regular
XGBoost Part 2 (of 4): Classification,https://www.youtube.com/watch?v=8b1JEDvenQU,regular
XGBoost Part 1 (of 4): Regression,https://www.youtube.com/watch?v=OtD8wVaFm6E,regular
Machine Learning Fundamentals: Sensitivity and Specificity,https://www.youtube.com/watch?v=vP06aMoz4v8,regular
"How to Prune Regression Trees, Clearly Explained!!!",https://www.youtube.com/watch?v=D0efHEJsfHo,regular
Support Vector Machines Part 3: The Radial (RBF) Kernel (Part 3 of 3),https://www.youtube.com/watch?v=Qc5IyLW_hns,regular
Support Vector Machines Part 2: The Polynomial Kernel (Part 2 of 3),https://www.youtube.com/watch?v=Toet3EiSFcM,regular
Support Vector Machines Part 1 (of 3): Main Ideas!!!,https://www.youtube.com/watch?v=efR1C6CvhmE,regular
"Regression Trees, Clearly Explained!!!",https://www.youtube.com/watch?v=g9c66TUylZ4,regular
"Pearson's Correlation, Clearly Explained!!!",https://www.youtube.com/watch?v=xZ_z8KWkhXE,regular
"Covariance, Clearly Explained!!!",https://www.youtube.com/watch?v=qtaqvPAeEJY,regular
"Calculating the Mean, Variance and Standard Deviation, Clearly Explained!!!",https://www.youtube.com/watch?v=SzZ6GpcfoQY,regular
Why Dividing By N Underestimates the Variance,https://www.youtube.com/watch?v=sHRBg6BhKjI,regular
"ROC and AUC, Clearly Explained!",https://www.youtube.com/watch?v=4jRBRDbJemM,regular
"Population and Estimated Parameters, Clearly Explained!!!",https://www.youtube.com/watch?v=vikkiwjQqfU,regular
"Stochastic Gradient Descent, Clearly Explained!!!",https://www.youtube.com/watch?v=vMh0zPT0tLI,regular
Gradient Boost Part 4 (of 4): Classification Details,https://www.youtube.com/watch?v=StWY5QWMXCw,regular
Gradient Boost Part 3 (of 4): Classification,https://www.youtube.com/watch?v=jxuNLH5dXCs,regular
Saturday,https://www.youtube.com/watch?v=HUzQIZLQxA0,regular
Gradient Boost Part 2 (of 4): Regression Details,https://www.youtube.com/watch?v=2xudPOBz-vs,regular
Gradient Boost Part 1 (of 4): Regression Main Ideas,https://www.youtube.com/watch?v=3CC4N4z3GJc,regular
Last Night,https://www.youtube.com/watch?v=xOOrxD92Wt4,regular
"Gradient Descent, Step-by-Step",https://www.youtube.com/watch?v=sDv4f4s2SB8,regular
A Drink From The Well,https://www.youtube.com/watch?v=Dr2aj85tcUI,regular
"AdaBoost, Clearly Explained",https://www.youtube.com/watch?v=LsK-xG1cLYA,regular
"Design Matrices For Linear Models, Clearly Explained!!!",https://www.youtube.com/watch?v=CqLGvwi-5Pc,regular
Wildest Dreams,https://www.youtube.com/watch?v=F7Gqjbg3bWI,regular
ROC and AUC in R,https://www.youtube.com/watch?v=qcvAqAH60Yw,regular
Christmas Morning,https://www.youtube.com/watch?v=Rvm1aMwcraY,regular
A Gentle Introduction to Machine Learning,https://www.youtube.com/watch?v=Gv9_4yMHFhI,regular
You Mean So Much,https://www.youtube.com/watch?v=hRdBqO4FFDs,regular
Machine Learning Fundamentals: The Confusion Matrix,https://www.youtube.com/watch?v=Kdsp6soqA7o,regular
"Ridge, Lasso and Elastic-Net Regression in R",https://www.youtube.com/watch?v=ctmNq7FgbvI,regular
Regularization Part 3: Elastic Net Regression,https://www.youtube.com/watch?v=1dKRdX9bfIo,regular
Regularization Part 2: Lasso (L1) Regression,https://www.youtube.com/watch?v=NGf0voTMlcs,regular
Little Red Fiat,https://www.youtube.com/watch?v=G9POY1cHn50,regular
Regularization Part 1: Ridge (L2) Regression,https://www.youtube.com/watch?v=Q81RR3yKn30,regular
Machine Learning Fundamentals: Bias and Variance,https://www.youtube.com/watch?v=EuBBz3bI-aA,regular
"Maximum Likelihood For the Normal Distribution, step-by-step!!!",https://www.youtube.com/watch?v=Dn6b9fCIUpM,regular
"The Central Limit Theorem, Clearly Explained!!!",https://www.youtube.com/watch?v=YAlJCEDH2uY,regular
Miss Carolina,https://www.youtube.com/watch?v=OxA6i3iJd7M,regular
"Maximum Likelihood for the Binomial Distribution, Clearly Explained!!!",https://www.youtube.com/watch?v=4KKV9yZCoM4,regular
"The Binomial Distribution and Test, Clearly Explained!!!",https://www.youtube.com/watch?v=J8jNoF-K8E8,regular
Happy Days,https://www.youtube.com/watch?v=tjLaxniTPmE,regular
"Maximum Likelihood for the Exponential Distribution, Clearly Explained!!!",https://www.youtube.com/watch?v=p3T-_LMrvBc,regular
"Logistic Regression in R, Clearly Explained!!!!",https://www.youtube.com/watch?v=C4N3_XJJ-jU,regular
Deviance Residuals,https://www.youtube.com/watch?v=JC56jS2gVUE,regular
Saturated Models and Deviance,https://www.youtube.com/watch?v=9T0wlKdew6I,regular
joe and sue,https://www.youtube.com/watch?v=EH4-RtVpsy4,regular
"Odds Ratios and Log(Odds Ratios), Clearly Explained!!!",https://www.youtube.com/watch?v=8nm0G-1uJzA,regular
Logistic Regression Details Pt 3: R-squared and p-value,https://www.youtube.com/watch?v=xxFYro8QuXA,regular
Logistic Regression Details Pt 2: Maximum Likelihood,https://www.youtube.com/watch?v=BfKanl1aSG0,regular
Logistic Regression Details Pt1: Coefficients,https://www.youtube.com/watch?v=vN5cNN2-HWE,regular
A War That We Can Win,https://www.youtube.com/watch?v=Glr8Qk3OZHc,regular
StatQuest: K-means clustering,https://www.youtube.com/watch?v=4b5d3muPQmA,regular
"Odds and Log(Odds), Clearly Explained!!!",https://www.youtube.com/watch?v=ARfXDSkQf1Y,regular
Hey Dom,https://www.youtube.com/watch?v=069WKnPyFnw,regular
Machine Learning Fundamentals: Cross Validation,https://www.youtube.com/watch?v=fSytzGwwBVw,regular
StatQuest: A gentle introduction to ChIP-Seq,https://www.youtube.com/watch?v=nkWGmaYRues,regular
"StatQuest: 10,000 Subscriber Milestone",https://www.youtube.com/watch?v=_ft2yqArm-I,regular
StatQuest: PCA - Practical Tips,https://www.youtube.com/watch?v=oRvgq966yZg,regular
"StatQuest: Principal Component Analysis (PCA), Step-by-Step",https://www.youtube.com/watch?v=FgakZw6K1QQ,regular
Darling of Mine,https://www.youtube.com/watch?v=kLQD8EJmnx8,regular
Probability is not Likelihood. Find out why!!!,https://www.youtube.com/watch?v=pYxNSUDSFH4,regular
StatQuest: Logistic Regression,https://www.youtube.com/watch?v=yIYKR4sgzI8,regular
Sunday Best,https://www.youtube.com/watch?v=nuumjAsHTxk,regular
StatQuest: Random Forests in R,https://www.youtube.com/watch?v=6EXPYzbfLCE,regular
"StatQuest: Random Forests Part 1 - Building, Using and Evaluating",https://www.youtube.com/watch?v=J4Wdy0Wc_xQ,regular
Love Song,https://www.youtube.com/watch?v=lrR9odYNNzs,regular
"StatQuest: Decision Trees, Part 2 - Feature Selection and Missing Data",https://www.youtube.com/watch?v=wpNl-JwwplA,regular
StatQuest: PCA in Python,https://www.youtube.com/watch?v=Lsue2gEM9D0,regular
She Blinded Me With Science!!!,https://www.youtube.com/watch?v=kGIIJ8rIrfs,regular
StatQuest: MDS and PCoA in R,https://www.youtube.com/watch?v=pGAUHhLYp5Q,regular
StatQuest: MDS and PCoA,https://www.youtube.com/watch?v=GEn-_dAyYME,regular
StatQuest: PCA main ideas in only 5 minutes!!!,https://www.youtube.com/watch?v=HMOI_lkzW08,regular
Snow,https://www.youtube.com/watch?v=adx4fsdwpfM,regular
StatQuest: PCA in R,https://www.youtube.com/watch?v=0Jp4gsfOLMs,regular
"Quantile Normalization, Clearly Explained!!!",https://www.youtube.com/watch?v=ecjN6Xpv6SE,regular
"Quantile-Quantile Plots (QQ plots), Clearly Explained!!!",https://www.youtube.com/watch?v=okjYjClSjOg,regular
"Quantiles and Percentiles, Clearly Explained!!!",https://www.youtube.com/watch?v=IFKQLDmRK0Y,regular
A Song For Only You,https://www.youtube.com/watch?v=Lg0okx38rOQ,regular
"Multiple Regression in R, Step-by-Step!!!",https://www.youtube.com/watch?v=hokALdIst8k,regular
"Multiple Regression, Clearly Explained!!!",https://www.youtube.com/watch?v=zITIFTsivN8,regular
"Sample Size and Effective Sample Size, Clearly Explained!!!",https://www.youtube.com/watch?v=67zCIqdeXpo,regular
The Difference Between Technical and Biological Replicates,https://www.youtube.com/watch?v=Exk0OoRG0PQ,regular
"The Normal Distribution, Clearly Explained!!!",https://www.youtube.com/watch?v=rzFX5NWojp0,regular
"Design Matrix Examples in R, Clearly Explained!!!",https://www.youtube.com/watch?v=Hrr2anyK_5s,regular
Employee Of The Week,https://www.youtube.com/watch?v=Odt_r4cAD8A,regular
"StatQuest: Histograms, Clearly Explained",https://www.youtube.com/watch?v=qBigTkBLU6g,regular
"StatQuest: t-SNE, Clearly Explained",https://www.youtube.com/watch?v=NEaUSP4YerM,regular
I'm Alive,https://www.youtube.com/watch?v=arSkMA2uLFU,regular
StatQuest: A gentle introduction to RNA-seq,https://www.youtube.com/watch?v=tlf6wYJrwKY,regular
StatQuest: How to make a Mean Pizza Crust!!!,https://www.youtube.com/watch?v=01205ys-GtI,regular
"Using Linear Models for t-tests and ANOVA, Clearly Explained!!!",https://www.youtube.com/watch?v=NF5_btOaCig,regular
Brothers,https://www.youtube.com/watch?v=UY8iYbxuzjc,regular
"Maximum Likelihood, clearly explained!!!",https://www.youtube.com/watch?v=XepXtl9YKwc,regular
"Linear Regression in R, Step-by-Step",https://www.youtube.com/watch?v=u1cc1r_Y7M0,regular
"Linear Regression, Clearly Explained!!!",https://www.youtube.com/watch?v=nk2CQITm_eo,regular
What is a (mathematical) model?,https://www.youtube.com/watch?v=yQhTtdq_y9M,regular
Boxplots are Awesome!!!,https://www.youtube.com/watch?v=fHLhBnmwUM0,regular
Your Dark Side,https://www.youtube.com/watch?v=FKM7hZKYEqw,regular
"StatQuest: K-nearest neighbors, Clearly Explained",https://www.youtube.com/watch?v=HVXime0nQeI,regular
StatQuest: Hierarchical Clustering,https://www.youtube.com/watch?v=7xHsRkOdVwo,regular
"Lowess and Loess, Clearly Explained!!!",https://www.youtube.com/watch?v=Vf7oJ6z2LCc,regular
The Sum of Regrets,https://www.youtube.com/watch?v=BXeZgqXAKAU,regular
The Main Ideas of Fitting a Line to Data (The Main Ideas of Least Squares and Linear Regression.),https://www.youtube.com/watch?v=PaFPbb66DxQ,regular
"StatQuest: edgeR and DESeq2, part 2 - Independent Filtering",https://www.youtube.com/watch?v=Gi0JdrxRq5s,regular
"Sampling from a Distribution, Clearly Explained!!!",https://www.youtube.com/watch?v=XLCWeSVzHUU,regular
Evil Genius,https://www.youtube.com/watch?v=TGvLteZCdAc,regular
StatQuest:  One or Two Tailed P-Values,https://www.youtube.com/watch?v=bsZGt-caXO4,regular
The Main Ideas behind Probability Distributions,https://www.youtube.com/watch?v=oI3hZJqXJuc,regular
"StatQuest: edgeR, part 1, Library Normalization",https://www.youtube.com/watch?v=Wdt6jdi-NQo,regular
The Rainbow,https://www.youtube.com/watch?v=Mgm-T-dILAQ,regular
"StatQuest: DESeq2, part 1, Library Normalization",https://www.youtube.com/watch?v=UFB993xufUU,regular
"Standard Deviation vs Standard Error, Clearly Explained!!!",https://www.youtube.com/watch?v=A82brFpdr9g,regular
Fisher's Exact Test and the Hypergeometric Distribution,https://www.youtube.com/watch?v=udyAvvaMjfM,regular
StatQuickie: Which t test to use,https://www.youtube.com/watch?v=nnBJeb_I-q8,regular
Mr  Hattie,https://www.youtube.com/watch?v=aVvTVYi5vBk,regular
Bar Charts Are Better than Pie Charts,https://www.youtube.com/watch?v=RiEZ_hEf96A,regular
"Logs (logarithms), Clearly Explained!!!",https://www.youtube.com/watch?v=VSi0Z04fWj0,regular
StatQuickie: Thresholds for Significance,https://www.youtube.com/watch?v=KEofcJ1tfkI,regular
A New Song,https://www.youtube.com/watch?v=zXEvFLj2880,regular
"False Discovery Rates, FDR, clearly explained",https://www.youtube.com/watch?v=K8LQSvtjcEo,regular
Psycho Killer,https://www.youtube.com/watch?v=MIgCbrNJyGo,regular
The Coldest Day of the Year,https://www.youtube.com/watch?v=68e5i5D8qYU,regular
I Love You,https://www.youtube.com/watch?v=DyaQp6Cz8RA,regular
p-hacking and power calculations,https://www.youtube.com/watch?v=UFhJefdVCjE,regular
Roses,https://www.youtube.com/watch?v=Rblav_ehMTE,regular
Nasty Weather,https://www.youtube.com/watch?v=G-9USywzN3E,regular
Maybe It'll Go Away,https://www.youtube.com/watch?v=R6ALolnItXg,regular
StatQuest: Linear Discriminant Analysis (LDA) clearly explained.,https://www.youtube.com/watch?v=azXCzI57Yfc,regular
Another Day,https://www.youtube.com/watch?v=xXqa7sVypYI,regular
Say Your Goodbyes,https://www.youtube.com/watch?v=cKdUdPAVyOU,regular
Deal With It,https://www.youtube.com/watch?v=-tibALm6VEI,regular
Rachel's Song (the ballad of Hazel Motes),https://www.youtube.com/watch?v=WkjBXrX1Q2k,regular
Drawing and Interpreting Heatmaps,https://www.youtube.com/watch?v=oMtDyOn2TCc,regular
Christmas In Rio! (now on iTunes!),https://www.youtube.com/watch?v=K2QWmW6LKmg,regular
That's Alright,https://www.youtube.com/watch?v=TCrC8Vdv1_4,regular
StatQuest: RNA-seq - the problem with technical replicates,https://www.youtube.com/watch?v=gKnfP2_Xdpo,regular
Principal Component Analysis (PCA) clearly explained (2015),https://www.youtube.com/watch?v=_UVHneBUBW0,regular
"RPKM, FPKM and TPM, Clearly Explained!!!",https://www.youtube.com/watch?v=TTUrtCY2k-w,regular
"Confidence Intervals, Clearly Explained!!!",https://www.youtube.com/watch?v=TqOeMYtOc1w,regular
How to puree garlic,https://www.youtube.com/watch?v=O33LgXNk87g,regular
That Dude (in the movies),https://www.youtube.com/watch?v=zB7CCWQbkWs,regular
"The standard error, Clearly Explained!!!",https://www.youtube.com/watch?v=XNgt7F6FqDU,regular
Wrapping up dumplings for pot stickers.,https://www.youtube.com/watch?v=fglJIFv08hs,regular
"R-squared, Clearly Explained!!!",https://www.youtube.com/watch?v=2AQKmw14mHM,regular
onion-dice,https://www.youtube.com/watch?v=Sn-keVh_ERw,regular
The Binomial Distribution in 30 Seconds!!!,https://www.youtube.com/shorts/aH3mZjHkAbs,shorts
"The Sensitivity, Specificity, Precision, Recall Sing-a-Long!!! #Shorts",https://www.youtube.com/shorts/PWvfrTgaPBI,shorts
The Exponential Distribution,https://www.youtube.com/shorts/wtLQUjfomig,shorts
"The mean, the median, and the mode.",https://www.youtube.com/shorts/-14BImgVENA,shorts
Cutting Butter,https://www.youtube.com/shorts/yMYcH8-OfJk,shorts
The Cosine Similarity for NLP and CatBoost,https://www.youtube.com/watch?v=c3xEDTh7Uc8,live
Live Stream - More details about Target Encoding/AMA/Silly Songs,https://www.youtube.com/watch?v=EzjtTh-WUWY,live
Live Stream - Target Encoding/AMA/Silly Songs!!!,https://www.youtube.com/watch?v=Za9wm6HWkvo,live
"Live 2020-06-15!!! Bootstrapping, Main Ideas",https://www.youtube.com/watch?v=isEcgoCmlO0,live
Live 2020-06-01!!! Hypothesis Testing,https://www.youtube.com/watch?v=hGoTUyBnbxg,live
Live 2020-05-18!!! Bayes' Theorem,https://www.youtube.com/watch?v=ONCOkccpk3w,live
Live 2020-04-06!!! Naive Bayes: Gaussian,https://www.youtube.com/watch?v=uHK1-Q8cKAw,live
Live 2020-03-16!!! Naive Bayes,https://www.youtube.com/watch?v=bTs-QA2oJSE,live
Live 2020-03-02!!! Virus Models and p-hacking,https://www.youtube.com/watch?v=8ECts3BErqk,live
Live 2020-02-17!!! Imbalanced Data and Post-Hoc Tests,https://www.youtube.com/watch?v=iTxzRVLoTQ0,live
"Live 2020-02-03!!! Statistical Models, Regularization, Best ML Algorithm.",https://www.youtube.com/watch?v=BKnM0MCGbVc,live
"Live 2020-01-20!!! Favorite ML, Data Leakage, How to Learn ML",https://www.youtube.com/watch?v=pSWRT9pObX0,live
"Live 2020-01-06!!! Sample Sizes, ML vs Statistics and a Poem",https://www.youtube.com/watch?v=jaXexgj2ONQ,live
Why Data Engineer is Better than Data Scientist Role,https://www.youtube.com/watch?v=YiwOc5RON5w,regular
How I use ChatGPT as a Data Scientist?,https://www.youtube.com/watch?v=VmdJ3qgyBDE,regular
5 Simple Ways to Automate Your Job using ChatGPT,https://www.youtube.com/watch?v=Q5DovFdZ5wE,regular
How to Become a Data Analyst in 2023?,https://www.youtube.com/watch?v=ID8QnPZU1mc,regular
How to Learn Python FAST with ChatGPT?,https://www.youtube.com/watch?v=tEn5BjRY8Uw,regular
Reviewing Data Analytics Program by CareerFoundry | Should you take it?,https://www.youtube.com/watch?v=lRvtvYr1LvY,regular
How I Would Learn Data Science in 2023? (If I could start over),https://www.youtube.com/watch?v=ZWgRvW8d_N4,regular
What does a Data Scientist Actualy Do?,https://www.youtube.com/watch?v=E2BwQ0GvDl4,regular
Learn How to Solve SQL Interview Problem for Data Science,https://www.youtube.com/watch?v=d3Ftx5lsbrU,regular
The Harsh Reality of Working in Tech (Right Now),https://www.youtube.com/watch?v=nMRCIrm3fBM,regular
Why I Left Data Engineering for Data Science (at FAANG),https://www.youtube.com/watch?v=gwVdOWkblDI,regular
Things I Wish I Knew Before Starting in Tech (from a decade at FAANG),https://www.youtube.com/watch?v=jc31uRs3of8,regular
Breaking Down the Data Scientist Job Search Trap (and how you can avoid it),https://www.youtube.com/watch?v=U2C1OqdCTfk,regular
What Programming Languages You Should Learn First? | Data Scientist,https://www.youtube.com/watch?v=5V39k0gM2F0,regular
The Harsh Reality of Being a Data Scientist,https://www.youtube.com/watch?v=pn0PUY0jwGQ,regular
Is Data Science Still “Sexy”? (Harvard did it again),https://www.youtube.com/watch?v=JgqC9KMDgRE,regular
How I Would Learn Data Science in 2022 (If I Could Start Over) part 2,https://www.youtube.com/watch?v=8UUhGXmT0O8,regular
Should you become a Data Analyst to become a Data Scientist?,https://www.youtube.com/watch?v=kr59DGtWDTs,regular
How I Became a Self-Taught Data Scientist with Non-Tech Background,https://www.youtube.com/watch?v=Zoc9USYVdWM,regular
Getting Promoted at Big Tech (New Salary + Anxiety),https://www.youtube.com/watch?v=Xl14LUZ8Izc,regular
I Failed Tech Interviews Until I did this Interview Prep Guide,https://www.youtube.com/watch?v=Ys2V85UMpjs,regular
The Highest Paid Job Family in Data Science (is it right for you?),https://www.youtube.com/watch?v=Vk2tuJ683JU,regular
Junior to Senior Data Scientist: Tips from Amazon Data Scientist,https://www.youtube.com/watch?v=Rll71HIFn-I,regular
Why Self-Taught Data Scientist Fail (and how you can avoid it),https://www.youtube.com/watch?v=5lHKXtvOlnw,regular
5 Things I Wish I Knew When I Started Data Science,https://www.youtube.com/watch?v=AgWWb_knCa4,regular
From Wall Street to Tech at Uber | How She Paved Her Path,https://www.youtube.com/watch?v=tXEymsPnAcg,regular
My Struggle with Imposter Syndrome in Tech - How You Can Manage It?,https://www.youtube.com/watch?v=b6ViJoUXUoM,regular
4 Reasons Why You Might Love Working in Data Science,https://www.youtube.com/watch?v=Do8ycToA1B0,regular
Data Science is Hard But Can it Be Fixed? | My Solution to the Industry-Wide Problem,https://www.youtube.com/watch?v=1HAfmJ7mpYo,regular
How I Would Learn Data Science in 2022 (If I Could Start Over),https://www.youtube.com/watch?v=65yXoFc5stI,regular
How to Solve SQL Interview Problems | Learn SQL Part 2/n,https://www.youtube.com/watch?v=iGCBUzUqRr4,regular
She Became AI Scientist From Software Engineer | Breaking Down Data Science w/ Microsoft Scientist,https://www.youtube.com/watch?v=sSuganrzF1E,regular
3 Mentors That Made Me Successful in Data Science & Big Tech,https://www.youtube.com/watch?v=BJoqpjM-Rqg,regular
Do You Need Math for Data Science?,https://www.youtube.com/watch?v=jjidSjVnOLk,regular
"Realistic M1 MacBook Pro 14"" Unboxing | Is It Worth it?",https://www.youtube.com/watch?v=x3bJoeBGHG4,regular
How is Life After Leaving Google and Paypal | Data Science Edition,https://www.youtube.com/watch?v=37X9Nbj9OnQ,regular
4 Things I Wish I Knew When I Started Data Science,https://www.youtube.com/watch?v=PKa1xCQBUWg,regular
Why I Left Data Engineering for Data Science,https://www.youtube.com/watch?v=wN_eu04kXhk,regular
Asking Parents What I Do for Living? | Data Science Edition (funny),https://www.youtube.com/watch?v=mTS926TuQWM,regular
Why is it Hard to Find a Job as a Data Scientist? 3 REASONS WHY,https://www.youtube.com/watch?v=fc6ZQX46Kz8,regular
A Day in The Life of a Google Data Scientist (Analytics),https://www.youtube.com/watch?v=CSdpk6NzvhY,regular
My Personal Finance Literacy Journey | Why you should care?,https://www.youtube.com/watch?v=lss-qWlnapQ,regular
Python vs R | Which is Better for Data Scientist?,https://www.youtube.com/watch?v=Z8JZEzG_nMI,regular
A Very Realistic Day in Life of a Data Science Lead at Google | Work from Home Edition,https://www.youtube.com/watch?v=GQzMiCBZw6Q,regular
Solving LeetCode SQL Problems | SQL Part 1/n,https://www.youtube.com/watch?v=3VJOfobpbkU,regular
3 Salary Negotiation Mistakes You Should Avoid | Tech Salary Tools,https://www.youtube.com/watch?v=26ZS-swTsps,regular
Reviewing Google Data Analytics Certificate | Should You Take It?,https://www.youtube.com/watch?v=yQNAooLLkzE,regular
Data science roadmap: What skills you should learn first?,https://www.youtube.com/watch?v=ylOILe-Sc-w,regular
My Data Science Journey with Non-Tech Background,https://www.youtube.com/watch?v=34r9OwjysDM,regular
How I Got into FAANG (Data Science),https://www.youtube.com/watch?v=K0yr0ZQ1_js,regular
Want to be a Data Scientist? This is the First Thing You Need to Do,https://www.youtube.com/watch?v=Jwc2SPl7v3Y,regular
First Day at Google - New York Noogler New Hire Orientation,https://www.youtube.com/watch?v=aZiQCz31J4E,regular
From 0 to 100K on YouTube 🎉Unboxing Play Button #shorts,https://www.youtube.com/shorts/vEYqXdDjHwE,shorts
M2 iPad Pro unboxing 11 256GB (Silver),https://www.youtube.com/shorts/uOw6zxNaXH4,shorts
Google FREE Data Science Courses #shorts #datascience,https://www.youtube.com/shorts/yi7yR1hzRkk,shorts
Don’t Become a Data Scientist If,https://www.youtube.com/shorts/4n7e0PL17DQ,shorts
How I write SQL FAST with AI (not ChatGPT)? | ft. @viktoriasemaan,https://www.youtube.com/shorts/TSLpULOGkh0,shorts
Learn Python for Data Analysis #shorts,https://www.youtube.com/shorts/poUZXmNQQws,shorts
Learn to Code in 6 Months But This #shorts,https://www.youtube.com/shorts/t6HBb-WEMaw,shorts
Tech Salaries: I wish this was taught in school,https://www.youtube.com/shorts/sydQQCS5qLM,shorts
Learn Python with ChatGPT: is this possible?,https://www.youtube.com/shorts/VUqdEJnI92g,shorts
Product Managers: is this true?,https://www.youtube.com/shorts/FeZ6q064mZc,shorts
Data Analyst SQL Question for Beginner,https://www.youtube.com/shorts/0piSMHA2C14,shorts
How I would learn data science fast?,https://www.youtube.com/shorts/o3DU3iWXTP0,shorts
The Reality of Big Tech Perks #shorts,https://www.youtube.com/shorts/UGzOFORVn4k,shorts
Data Analysts vs Data Scientist: True Story? #shorts,https://www.youtube.com/shorts/kDYVQb91vt4,shorts
Tech interviews are hard #shorts,https://www.youtube.com/shorts/LAmVx1GIb-s,shorts
Snap Layoffs 20% Employees (Messy) #shorts,https://www.youtube.com/shorts/tuUpwYqeugk,shorts
3 SQL Interview Prep Resources #shorts,https://www.youtube.com/shorts/c2gKjr7qf6I,shorts
A Day in Life at Google London Office #shorts,https://www.youtube.com/shorts/FlG_6190LM0,shorts
Job families in data science #shorts,https://www.youtube.com/shorts/byLc-G1NsNw,shorts
Are you this data scientist? #shorts,https://www.youtube.com/shorts/bdKSKEc-zRI,shorts
Tell me about yourself? #shorts,https://www.youtube.com/shorts/Qyy6WDE-sAA,shorts
Make entry-level entry-level already #shorts,https://www.youtube.com/shorts/pmYHBWCo504,shorts
Data Science Job Families #shorts,https://www.youtube.com/shorts/nksGZmKHGg8,shorts
